,TranslatedDescription,Assignment group
2181,uacyltoe hxgayczeing email notification,GRP_36
2182,poble mit wlan laptop weszfyok fbadnjhu,GRP_24
2184,cm sceen advance find ceate view  select next scoll symbol move quey nealy impossible,GRP_0
2185,infopath wok,GRP_0
2186,poble mit jionmpsf wnkpzcmv,GRP_24
2187,monito vom fa alysege defekthallo kannst mal bei labo vobei schauen ist defekt clqfpgt tbnovxdp anspechpatne,GRP_24
2188,poblem change passwod  ,GRP_0
2189,file shag  equie  send video machine custo ugent basis size kindly let know,GRP_0
2190,issue add lean tacke collaboation platfom  desk today  open event link ente new poject detail get eo ssage sceen shoot attach efeence  ful claification evet back,GRP_0
2191,add  distibution list   madam wam,GRP_0
2192,uacyltoe hxgaycze,GRP_0
2193,pls lock window accot use vvgoythttu,GRP_0
2194,skype business wok    laptop pint sceen attach teamviewe satlgeo lhqksbdx passwod,GRP_0
2195,passwod vpn distibuto tool sync m poblem log etc access change  advice would geatly appeciate,GRP_0
2197,telephony softwae log issue window update issueuse voethylke  follow eason authentication fail emote paty close tanspot steam  attachnt well,GRP_7
2198,use gokcethy sid uacyltoe hxgaycze system  team login   check best,GRP_0
2199, new mouse eemw compute malefktion,GRP_42
2200,host austalia patch antivius site seve offlineit offline  oct,GRP_12
2201,aiiw india patch antivius desktop site seve offlineit offline  sep,GRP_19
2202, log skype cetificate eo,GRP_0
2203,eset sid passwod equest send acoss,GRP_2
2204,miss confimation ep  clockit m tansfe tool stop delay clock geman ti  attachnt,GRP_59
2205,new doct type show listwhen ceate enginee tool  thee doctypes peviously soone add ecently sid,GRP_11
2206,netwok outage poncacity schlumhdyhte dmvpn oute  type cicuit powe  specify top cet site  stat schedule maintence  povide maint ticket backup active contact notify phone email emote dial equipnt eset veify wok vendo global telecom veizon gsc additiol diagnostics,GRP_8
2207,application esponse ti netwok esouce wok nomally  povide detail template multiple impact use quick ticket opeation folde site location gemany use system  pefomance poblem list cm ep bobj tansaction slow ceate ode sid take second build page aea belong sale fince makhtyeting etc issue eplicate suppot goup attach elevant sceenshots exact occu,GRP_0
2208,powe outage gemany fine machine  seconday vpn cicuit seve show  type netwok  specify top cet site  stat schedule maintence povide maint ticket backup active contact notify phone email emote dial equipnt eset veify wok vendo global telecom veizon gsc additiol diagnostics,GRP_8
2209,ep wok multiple use seve host ping,GRP_4
2210,ugent tool gemany cuently possible close ode efeence ticket data en affect seveal epot complete miss,GRP_25
2211,data compaison tool ep gemany,GRP_25
2212,netwok access intel had dive pint wok pinte seve,GRP_12
2213,passwod eset  use quality uacyltoe hxgaycze ep ayhtuov,GRP_0
2215,ie flash playe issue  take ethic tain couse show eo  ful even update,GRP_0
2216,poblem lean tacke  ceate new click save upgade option  esolve,GRP_0
2217,access shae mail box investo elation   usa add shyesh dyty kindly ful,GRP_12
2218,oacle listene monito epot wan status host  investigate,GRP_1
2219,outlook use get cm configue teday vesion ealy old new instal along mail download evey ti specially one folde,GRP_0
2221,net famdntyewok instal ep eo micosoft  desk  appove cedit mo pe attach wokflow mail ssage show  open pogamdnty  fix issue aep  soon best,GRP_0
2222,ep incident status changethis sid,GRP_0
2224,get audio skype  ugently et today  jashtyckie language bowse micosoft intenet exploe email custo numbe telephone summay ugent,GRP_0
2225,host volu dev sid data space consu avail ghost,GRP_1
2227, open attachnt outlook,GRP_0
2228,access seve file ldg new plant mage usa facility  dive simila pevious misuhet milsyt,GRP_12
2229, update passwod,GRP_0
2230,node lhqsm locate usa ,GRP_12
2231,vip  login window,GRP_0
2232,outlook feeze  openca folde update  exit  get back open,GRP_0
2233,system slow pocess shipnt plant evey even sotis chk ship tool shippping last couple month fyzceglp vfnaqxc supeviso shift contact additiol infomation  ticket ente night octobe close moning oct happen,GRP_18
2234,ep access issue useid uacyltoe hxgayczekutya system sid hp ente use tansaction code  wok descibe validation hxgayczeing  extend accot month get authoize ssage eceate condition nsu attach esult ticket tool povide,GRP_2
2236, schedule skype et option long outlook,GRP_0
2238,key figue take bex alyzekey alyze sale evenue get emove autamatically,GRP_9
2241,call out laptop telephony softwae phone,GRP_7
2242,connect wieless outside  usa attachnt connection avail   eview figue  hotel access,GRP_0
2244,access collaboation platfom link,GRP_0
2245,add shae mailbox outlook summay file dieppeaed leave side sceen,GRP_0
2246,housekeep coe file host   check feasibility add additiol space dev gpfsfs justification epot fail due issue ntion mot point,GRP_47
2247,ep access issuesystem sid hp ente use issue keshyslsj tansaction code  wok descibe foget passwod get authoize ssage eceate condition nsu attach esult ticket tool povide,GRP_2
2249,cm add miss,GRP_0
2250,job fail schedule,GRP_18
2251,knock vpnvpn disconnect incoming call,GRP_0
2252,skype audio wok,GRP_0
2253,m cm dymic outlook issue,GRP_0
2254,appea file pocess wok apps devt maint ebusit submit channel patne   attach log last ti monday octobe,GRP_20
2255, access bobj exploe epotsi epot get eo  look,GRP_14
2257,soon select fincial toolscal yea toolcal month  oveall value get data find contact summay bex show esult limit ti peiod sind appox min gneal issue mont  ceate epot uppe magent sale infomation staeted seveal even eboot note ugent filly eview tomoow moning pull bch check anothe colleague appea,GRP_9
2260,poblem pot  ewew povide coect  fen,GRP_24
2262, connect outlook ho netwok,GRP_0
2263,system disk seve host full   check issue week ago ticket inc identify solve cause poblem impact vitual cente,GRP_12
2265,pinte issue delivey note window ptgt contact eo ssage install dive access deny pint ep,GRP_3
2266,epot none lookup sot featue avail access tool howeve field uppe ight cone allow manipulate show blank sceen shoot  efe attachnt,GRP_9
2267,ugent  equie outlook cm mfg tooltion issue contact,GRP_0
2268,ticket follow inplant summay open incident equest inco akthh esolve,GRP_0
2269,job bwhchg fail schedule,GRP_9
2270,townhall etingwe  nwfoucba dzbujamc gemany pepaation technology town hall et octobe begin clock,GRP_28
2271, access bobj epot,GRP_0
2272,cicuit outage vpn oute t site to type netwok powe  specify top cet  stat schedule maintence  povide maint ticket backup active contact notify phone email emote dial equipnt eset veify wok vendo global telecom veizon gsc additiol diagnostics,GRP_8
2273,email set issue summay hit wong button ss mail fomat delete anything ho,GRP_0
2274,use call speak nicdhylas hidhys ask send email skype avail,GRP_0
2276,static noise inteaction,GRP_0
2277,compute    new sevice tag ddwjm,GRP_0
2279, issue enginee tool system  feel soy say late face lot  note appea ascend ode alphabet look paticula beco nightmae best,GRP_25
2280,ceate inspection plani wok plan m  view batch numbe  lot well eithe valid type mateial find select wan  assist alloy  ship today contact phone,GRP_45
2281, make outbod call siens phone system,GRP_37
2282,wk qdxyifhj zbwtpyhalo pinte cause poblem pint  check set thank uwe,GRP_33
2283,authoisation povide supeviso ole use haajksjp plant system sid send iphone,GRP_2
2284,netwok outage site enginee toolkuznetsk ussia  type cicuit powe  specify top cet  stat schedule maintence  povide maint ticket backup active contact notify phone email emote dial equipnt eset veify wok vendo global telecom veizon gsc additiol diagnostics,GRP_8
2285,poble mit vpn weszfyok fbadnjhu,GRP_24
2286,poble mit potal fanjuz ubghty,GRP_24
2288,ussia inteface vlan enginee tool whaehouse lan  toolkuznetsk dmvpn t com,GRP_8
2290,poblem outlook client database synchonize,GRP_19
2291,micosoft outlook issuehi team  get mail intemittently ti  update folde sotis wok like  look issue,GRP_0
2292,upgade office cuently two vesion compute instal bite folde pls delete old epai new one,GRP_0
2293,ep inte inwaehouse tool issue sto batia ben shloosh send wednesday septembe huji uhy ujteoza mcoswhjuanthila yayuel sayatg hkfipags sdilxfk zucjgvp ioqjgmah jhdythua htayhil udmbwocs kegsjdva   find lauacyltoe hxgaycze infom cuency poblem occu new shipnt show total amot eal value numbe check ugently cuently hold waehouse  coespondence pevious je,GRP_10
2294,login possible  colleague  fen diehm ask question click log thank gu,GRP_0
2295,ep use passwod wok   madam ful egad subject matheywte ssage show wong fyi wam,GRP_0
2296, logon ep via vpneo ssage system sid patne each eo connection efuse,GRP_0
2298, ceate plant ugent ship point dns,GRP_6
2299,lean cetificate get send automaticallyhi khadfhty today ceate anothe event still automatically ecipient  list section  facilitato  appea happen past equest kindly fix issue pioity,GRP_16
2301,poble mit alico ch update jionmpsf wnkpzcmv,GRP_24
2302,setup jionmpsf wnkpzcmv,GRP_24
2303,chg stop eminde  ten mail fa appoval ticket sample attach take imdiate step aleady appove best,GRP_0
2304,eset passwod    dpajkhy hwvjympt websty imdiately let know best,GRP_0
2306,issue enginee tool softwae    option ceate new custo deale    esolve,GRP_25
2307,poblem access daw netweave business clint  colleague open aleady connect coespond app via vpn follow ssage co  best suppot,GRP_0
2309,outlook cm get sync,GRP_0
2311,k suppot netwok elate issue   access ep file face poblem past week daily basis addess local team get esolve case cause lot distubance suppo eo ssage  log sid day connect guest  change secue ,GRP_19
2313,inteface fastethenet ticlock clh toollant ,GRP_8
2316,access ep vpn  login sid ho eo ssage juhu jojfufn logistics mage mailto select follow link view disclai altete language,GRP_0
2317,ey consultant  login citix attach eo sceenshot kindly ful,GRP_12
2321,austalia cuently expeience long load ti ep  elituyt language bowse micosoft intenet exploe email custo numbe telephone summay  look,GRP_0
2322,ep  incedibly slow  load page kick kind,GRP_0
2323,ep slow happen evey night stat pm fyzceglp vfnaqxc language bowse micosoft intenet exploe email custo numbe telephone summay pm,GRP_18
2325,vip pocess paynt potentiol secuity attemptfom xmjwanes astmvqhc send wednesday octobe nwfodmhc exucwkm akthh attempt open  attach ealy today mac diecto human esouce oigil ssage mailto tuesday make list item  find  com offe discot bulk ode contact detail,GRP_26
2326,window lock use laijuth  desk team  assist lock imdiately,GRP_0
2331,job fail schedule,GRP_44
2332,miss owtlmpuv oicjsfh team calenda page one peson dthyan matheywtyuews sale mage mailto,GRP_0
2333, connect vpn update passwod,GRP_0
2334,passwod expie,GRP_0
2335,m cm dymic eo outlook addin,GRP_0
2336,use want cm mobile app donwloaded,GRP_0
2337,access deny collaboation platfom libay  application suppot call mail tansfe mbe put hold soone else may avail seach ssage get poblem pesist contact team include technical detail coelation date ti use issue type pemission,GRP_16
2338, cm add outlook ibbon micosoft mfg tooltion,GRP_0
2339,powe magent quey,GRP_0
2340,vip  load collaboation platfom site site,GRP_0
2341, ho page load best,GRP_0
2342,usa access fince copoateaccoting patne cash bank econciliation misc accot pjxclyhs fcniljtu send tuesday octobe nwfodmhc exucwkm jwoiyzfp zlftkpq liz domasky tupthyti folde ticket  ead follow kind,GRP_34
2343,lhqsm patch antivius pod node locate usa ,GRP_12
2344, load outlook,GRP_0
2345,collaboation platfom wok seve busy uvail,GRP_16
2346,ugent  equie outlook cm mfg tooltion issue oyhtub haujtimpton  access thu,GRP_0
2347,change owne collaboation platfom link,GRP_0
2348,coffee spillage keybankd,GRP_3
2349, check maftgytin pfne useid hoepftyhum get cm eo ssage  open foecan foecast plan dashbankd,GRP_22
2350,save excel file accidentally speadsheet anothe way ecove day ago,GRP_0
2351,quey cm app,GRP_0
2352,pinte configue laptop,GRP_19
2353,lock pouxnwb yfaqhceo  change passwod teday oacle fusion middlewae poduction ente old new log box keep pop let sohow back access system today neithe wok happen past szewiguc nvajphfm would lock soone  get coect,GRP_1
2354,audio lat,GRP_0
2356,cicuit outage south aitca vpn oute site pimay type netwok powe  specify top cet  stat schedule maintence  povide maint ticket backup active contact notify phone email emote dial equipnt eset veify wok vendo global telecom veizon gsc additiol diagnostics,GRP_8
2357,issue use pofile host m ss seve ceate  investigate monito tool co acoss eo ssage attach sceenshot ,GRP_12
2358,enew intel cetificate passwod magent tool mage discuss  assist mage,GRP_39
2359,ticket upadate inplant,GRP_0
2362,ugent  shae  catalog data extel use summay  collaboation platfom issue diectoy file tell column,GRP_16
2363,use usa eceive inbod extel callsuses call intel extension wok outbod,GRP_37
2364,miss email access peviously aitcas hssc mail box outlook long avail set vpksyfco chosuygq,GRP_0
2365,lock eset passwod use vvamot infom m expie sid poceed check ,GRP_2
2366,outlook stick pocess,GRP_0
2367,ep gui miss login option xhaomnjl ctusaqp,GRP_0
2368,xhaomnjl ctusaqp call ep accot lock,GRP_0
2369,window acccot lockout,GRP_0
2370,update inwaehouse tool doct list sale og gemany office move main pinte get tempoaily totally delete accident ep big bulk aleady eissue bill date august output yet  attach via coect type automatically add theefoe  mass change mode save miss pintout issue appopiate exist might amongst good action equie impotant  egula job ti note spool  assign accot depatnt howeve would geneate custo eminde dnings clealy tace audit eason pint out soon possible  suppot equest annoy wong question hesitate contact,GRP_13
2371,client laptop tun,GRP_3
2373,poduct magent maste key figue dieppea sample efesh best,GRP_9
2374,eo  log ethic say ecod indicate cedential use access site  collaboation platfom match file within active diectoy,GRP_0
2375,email addess newly block send attachnt  emove,GRP_26
2376,ep font small new laptop latitude image installation little definition  logon  chaatche indication,GRP_0
2377,skype login change passwod  ecently  netwok log email vpn etc sign business anymoe get notification say poblem acquie pesol cetificate assistance povide would geatly appeciate,GRP_0
2378,second monito wok  stop get pictue soone  co take look,GRP_3
2379,eset passwod fueiklyv jagqpkm ep poduction ep sid,GRP_0
2380, emove pofilei update pofile new single sign yet still appea affect numbe outlook well anyone contact list associate employee seach ,GRP_2
2381,passwod eset equest use follow oganization pefom accot fist  donthy last well conside contact validate authentic continue detemine valid use sevice admin potal office window inte azue etc want let check en click ely  inc ssage send monitoed email addess  eply,GRP_0
2382,eu tool ewew wok jionmpsf wnkpzcmv,GRP_24
2383,bluesceen ewew wcktgbd wzgyphallo show blue side many white lette type optiplex   best,GRP_24
2384,key figue dieppeas ugent efe inplant update exist poduct magent maste dieppea show column  download disttgoyed last month issue anybody make change palluty pande coect back maybe involve bussy end data imdiately  set sample efesh best,GRP_9
2386,passwod eset equest use follow oganization pefom accot fist  hyeonthygwon last lethe conside contact validate authentic continue detemine valid use sevice admin potal office window inte azue etc want let check en click ely  inc ssage send monitoed email addess  eply,GRP_0
2388,system take long ti espond passwod eset stack guad eo co outlook,GRP_0
2389,use lndypaqg dhqwtcs gogtyekthyto hat sein passwot ep sid veggemany,GRP_0
2390, connect expense eimbusent webpage page fail load,GRP_0
2391,distibuto tool list favoite custosissue occu ecent passwod change,GRP_0
2392,guts lupiepens email fowad leave  usa facility septembe assu patial esponsibility  set coespondence addess advise anything else equie pat mage xpoqctb zwypjqv,GRP_26
2393, eset passwod ha sid useid bathishy,GRP_53
2395,host fcseve exe pocess cot sevice,GRP_14
2396,xcelion pocess auto wok design esult block inwaehouse tool additiol buye contol  coect miss good eceipt attach file make pemanent coection tily fashion fowad close ticket fix uacyltoe hxgayczeed place,GRP_29
2397,cm app io,GRP_0
2398,schfk dock station  eplacentdesk cubicle numbe custo sevice depatnt usa phone laptop model latitude diect connection monito wok,GRP_3
2399,collaboation platfom access  poject doctation link long accessible eo ssage jaytya ceate leave anwhile pehaps deactivation accot  eason anyway   get povide instuction change owne,GRP_16
2401,view daw enginee tool ep gui business client take long nomal couple day  huge pefomance issue fue,GRP_14
2402,updation equie flash playe   find compatibility check get lach ethic kindly thu ful system detail povide quick view,GRP_0
2403,plm enginee tool pdf file open eo attach  take extely long ti nowadays sotis ssage  appea without,GRP_14
2404,info type miss pesol numbe qkmvosen opdxsk send tuesday octobe nyifqpmv kfixjag tavel expense mage  tansaktion wok  check,GRP_10
2405,poble mit vzqomdgt jwoqbuml,GRP_24
2406,sinic geneal eo odbc vmsliazh ltksxmyv dive quey tiout jionmpsf wnkpzcmv,GRP_24
2407,poblem pinte fdyietau dvsyxwbuhallo copie tain oom  defective minolta  look,GRP_24
2409,msd cmugent  equie cant link appointnt accot cm tab outlook ente set egad put nothing co,GRP_40
2411,outlook issue pull send email delay houlogin peathyucoj today get almost hou  hang outbox long ti filly,GRP_0
2412,pick call phoneebhl ing,GRP_7
2414,accot lock passwod eset equest,GRP_0
2415, access scan zugiff auf vezeichnis angefagt folde equest benutze use ahujajtyhu die position titel title executive sale admin at zugiffs type ead full contol  vogesetzten mage cobsfvjz apkqmdu   assign scanne system best,GRP_19
2416,   desk send emal thu web mail open office outlook due eo ssage say ceate new gad page stack thing change pas wod ecently accodance auto notification system  solve touble quickly stat use outlook daily wok email addess yathyu mobile phone asistance highly appeciate best,GRP_0
2417,wifi connect,GRP_0
2419,cm extension foecast view  button instead potential spend soone  eadd,GRP_40
2420,app poblem  colleague outlook co box pesent best,GRP_0
2421, ceate delivey povide follow ode numbe mateial item waehouse location plant issue desciption eo ssage,GRP_29
2422, ethic couse mail  long ti kothyhe think least peiod insist look hallo kollegen ich sollte eigentlich ine vog nge ababeiten dazu habe jedoch keinelei einnegsinfomationen bekomn noch einen link wie potal kom deswegen vesucht be hub komn auf login ged ckt dann den button deutsch kommt keine offene session ist t mit fedlichen best,GRP_23
2423,fequent accot lock,GRP_0
2425,pognose cm foecast plan dashbankd wok esouce find eo  one use affect get sale ep indicate open,GRP_22
2428,still  salespeson uacyltoe hxgaycze pefom enginee tool    alpaslanthy language bowse micosoft intenet exploe email custo numbe telephone summay ,GRP_25
2429, login ethic potal kxmidsga zokivdfa   eo sceen shoot attach kindly  full best,GRP_23
2430, povide access dive  team  full contol path mbe makhtyed depatnt host file scoecad india iscl update sagfhoshgzpkmilu skwbuvjyheelavant mailto fahdlecz eathyu ihkolepb ozhnjyef culixwse pmvxbnjhivaamdntyaiah,GRP_12
2431,issue bobj  fix bobj poblem mjvfxnka zvjxuahe  eo ssage,GRP_9
2432,poblem wifi  use dell latitude ho office netwok intenet access often wake powesave mode still connect local identify connection pivate own device smatphone tt wok fine shut estat get pope  advise couple ti day annoy kityling best,GRP_0
2433,ticad access ticket tooli notice tool en,GRP_36
2434,job host failagain fail schedule,GRP_8
2435,pgi delivey note possiblepgi possible   enclose ssage,GRP_2
2436,job host fail schedule,GRP_8
2438,login,GRP_33
2439,woy mit fedlichem gu kind,GRP_0
2440, login host vsphee client vmwae vitualcente seve sevice stop state,GRP_12
2441,mateial specification codethe code tn hdt kmc avail ep system select enginee tool eo exist,GRP_11
2442,plm entepise seach enginee ecod woking  wok plugin miss accod eo ssage status ba  attachnt,GRP_11
2443,equest eset micosoft online sevice passwod use follow oganization pefom accot fist  tyhufey last thyel conside contact validate authentic continue detemine valid use admin potal office window inte azue etc want let check en click ely  inc,GRP_0
2445,vh wek gemany fehlende duckauft eilt motswechsel bei ducke keine ausgabe ep hp duck wod excel fktioniet wude beeits ausgeschaltet d neu gestatet ohne efolg  complete equie question etun back gsc equeste povide infomation eview ticket  esolve assign appopiate goup pe pinte poblem assignnt flowchat  make model detail desciption type doct pint email etc inwaehouse tool delivey note poduction ode system application use ti window kls espond ping command netwok powe cycle sid plm output eouted anothe tempoaily coectly scan copy attach,GRP_0
2446,ethic application find   open tain couse   eo sceenshot,GRP_0
2447,ethic login issue   highlight eo esolve ugent basis best,GRP_23
2448, login ethic tain cousehi  couse get web page egisteed use  ,GRP_23
2449,issue play couage change win video    ssage get  open lauacyltoe hxgaycze,GRP_0
2450, pint pinte pinte welco next avail agent shotly inteaction alet website visito join convesation dwfiykeo agtxmvcuma  zheqafyo bqipxag good moycthbkm plvnuxmnoj  india  poblem happen evey month let check local ight deppt,GRP_19
2451,install lauacyltoe hxgaycze vesion flash playe   system get ssage show  complete ethic couse collaboation platfom site,GRP_0
2453,sid passwod  eset daypay,GRP_2
2454,ep pefomance moning via vpn gemany stat epot take nomal minute get esult cuent ist still  issue use wethuibeg,GRP_0
2455,collaboation platfom site open,GRP_0
2456,change adhi epot line outlook oganization system wong elocate usa apac vlpfgjyz dvzfsbo title enginee eflect   coect,GRP_2
2457,flash playe vesion   assist follow issue,GRP_0
2458,log vpn ticket tool change passwod moning wokingfom datnl powloisky mailto send monday octobe nwfodmhc exucwkm akthh login poblem wok  eset use poloidgthyl keep get eo danl poloisky teitoy mage fedeal sigl usa,GRP_0
2459,summay  wip list  epot get ti eo pivot t field  valid,GRP_0
2460,issue cm dymicsissues dymic  pemission open ecod use get eo uvail equest find sufficient view,GRP_22
2461,accot expie soon   extend vvwhtyuy one yea use mage  mikdhyu lihy,GRP_2
2462,eceive infomation team oigilly enquiy stat august nothing and cuently email notification like ethic ethical mont sippp  log via collaboation platfom follow eo ssage welco  business conduct cente tain site ecod indicate cedential use access match file within active diectoy  submit ticket global suppot ensue netwok coectly ente ep assist aep set,GRP_2
2464,kick vpni vpn ti today,GRP_0
2465,potential secuity issue update,GRP_0
2466,outlook eo,GRP_0
2467,ugent  equie outlook cm mfg tooltion issue  tab ibbon  advise fjohugzb fhagjskd channel patne specialist  inc mail office technical suppot www com,GRP_0
2468, connect wielessuse call issue  wieless netwok use dell tt device,GRP_0
2469, update new passwod iphone,GRP_0
2470, update passwod accot,GRP_0
2471,netwok outage cantabia cftgobusa site had  type cicuit powe  specify top cet  stat schedule maintence  povide maint ticket backup active contact notify phone email emote dial equipnt eset veify wok vendo global telecom veizon gsc additiol diagnostics,GRP_8
2472,ethic tain  stat beco stick page  contact aep best,GRP_0
2473, open edit expense epot employee,GRP_0
2474,log maty nevins use nevinmw login compute shugott tyhuellis usa facility mg mailto,GRP_0
2475, safe attachnt epwhen  file sale ode ep fallowing eo occu upload knowledge povide,GRP_0
2476,sale histoy coect apo jochgthen team appea issue septembe look,GRP_6
2478,extel site load,GRP_0
2480,cm outlook wok gethyg,GRP_0
2485,get knock vpnwas vpn today poblem almost evey day,GRP_0
2486,puchase supplie state use catalog long  select say,GRP_29
2487,vpn connectivity issuesmy dop twice moning  lch,GRP_2
2488, ente estimate value oppotity cm,GRP_22
2489, sign outlook,GRP_0
2490,eset window passwod accot,GRP_0
2491, login ep,GRP_0
2492,pint equest tansaction diffeent pinte  contact omiwzbue auvolfhp info complete equie question etun back gsc equeste povide infomation eview ticket  esolve assign appopiate goup pe poblem assignnt flowchat  make model ptqv detail desciption type doct email excel wod etc inwaehouse tool delivey note poduction ode ep system application use ti window kls espond ping command netwok powe cycle sid hp plm output eouted anothe tempoaily cuently out fix  job coectly scan copy attach,GRP_45
2493,passwod change,GRP_0
2495,old vesion ethic tain accot   thank,GRP_23
2496,map dive,GRP_0
2497,cm synching mail,GRP_0
2498,vpn ep log get tieso automatically wok cant m much keep back  fix mnlvhtug imvetgoa application enginee geneal  inc mailto,GRP_0
2499,use wish set lan fist pioity intenet laptop make wieless disconnect connect  ldvl,GRP_3
2500,extel calle ask vtykubi whsipqno email addess,GRP_0
2502,lock ep sid accot,GRP_0
2503, install enginee tool people  team  employee compute client ccfteguss acces site hou appea eo attachnt instuction,GRP_0
2504,monito wie,GRP_3
2505, find  sale peson enginee tool tool phone,GRP_25
2507,usa plant switch seve site,GRP_8
2508,intenet downlwgytuxq qspdztiw call issue completely  access ep application contact,GRP_4
2509,outlook calenda shag  shae mage ick oelli get eo ssage biintll tujutnis senio sale enginee team mailto www  com,GRP_0
2510,quote wokflow item  save appea delete line   get,GRP_13
