,TranslatedDescription,Assignment group
4312,pinte poblem issue infomation eoute back  complete equie question etun gsc equeste povide eview ticket  esolve assign appopiate goup pe assignnt flowchat  make model detail desciption ep fix type doct pint email excel wod etc inwaehouse tool delivey note poduction ode system application use ti window kls espond ping command netwok powe cycle sid hp plm output eouted anothe tempoaily coectly scan copy attach,GRP_5
4313,instala docad eletonicouse olghiveii segue link,GRP_62
4314,speke skype confeencesit gemany speake equie confenece oom confeence behind cantine theefoe michghytuael cke confim puchase new two xvwchsdg pladjmxt suggest one big instead  check pice allow compae possibility,GRP_33
4315,use safghghga  eset passwod  pls  ceate new passwod gabyltka sabhtyhiko block compute access aep  contact do,GRP_2
4316,poblem cm lead  convet oppotstoage poduct qualify get eo   advise vkzwafuh tcjnuswg cmp application eng,GRP_15
4317, iphone device activation,GRP_0
4318,vip  get netwok,GRP_0
4319,pinte seve host ight add fine  pint continuously chaacte symbol use lasejet tim koma look,GRP_12
4320,get ep issue delivey sto tuck schedule pick todaystock avail appaently apo   etun scap powde plant,GRP_6
4321,fitness cente digital sigge connect netwok get update,GRP_3
4322, logon ep,GRP_0
4325,wg daw vgsqetbx wpkcbtjl send thusday septembe dnwfhpyl zqbldipk subject  anothe incoectly pint numbe  coect kindly poduction planne  poduktions gmbh mailto ftsfald tfhzidnq wqpfdobe ksvqzme yqjdwh concen ep plm diffeent heighjtyich apologize wong gdw accidentally e second ti month live aleady convet always top ight stamp  many scan  nictafvwlpz opfigqamdntyatically pdf soy poblem make hded m epai necessay best,GRP_11
4326, access emailnot email itclukpe aimcfeko mage,GRP_0
4328,job sid ac fail schedule,GRP_8
4332,vpn doesnt check antivius  domain connect outside netwokefe sceenshot,GRP_2
4334,system disk seve host full   check issue week ago ticket inc vitual cente,GRP_12
4335,epot tool issue daily sale ode eply panjkyt  ceate case  possibility subscibe dedicate eceive mti data pe email instead total industial esult consist combine mit fedlichen gugemany best,GRP_9
4337,m tmqfjad qzhgdoua odiy equie full access follow tool module fyi axesnghb cyzuomxa send thusday septembe ughzilfm cfibdamq subject authoization  bghakch poduction gemany mage diecto phvkowml azbtkqwx uedlk mpvhakdq egiste office pesolly li patne geneal  gmbh commication intend solely use addes may contain infomation confidential applic law disclosue exceptions distibution epoduction peson ecipient stictly fobid due mistake eceive  notify sende ssage select link view disclai altete language,GRP_59
4338,application esponse ti netwok esouce wok nomally  ship poduct usa get put away ticket system take estoage poductly long pocess tansaction eo state update temite site location  ohio use lilesfhpk  pefomance poblem  list cm ep bobj sid slow ceate ode aea belong sale fince makhtyeting etc poduction issue eplicate suppot goup sue attach elevant sceenshots exact occu,GRP_18
4339,equest mobile email access   attach fill wieless mobility policy sheet mage appoval kindly en contact infomation equie egad best,GRP_0
4341,  log ep get eo   ugently pocess custo ode,GRP_0
4342,compute get hot  fan  ti hea mit fedlichen best,GRP_28
4343,c vga swap jionmpsf wnkpzcmv,GRP_24
4344,monito defective  aht mateial waehouse cause poblem  look,GRP_24
4345,install pulveleitstand tmqfjad qzhgdoua,GRP_24
4346,incoect fomat pdf bfqnvezs vwkasnxe,GRP_24
4347,install pulveleitstand vaigycet jtgmpdc,GRP_24
4349,cm complaint ticket equie   aise behalf eo achive ecc best,GRP_15
4350,login failue ep use nieghjyukea  team poblem  assist kind,GRP_0
4351,ep enginee tool  eset passwod dipl ing bqapjkcl ljeakcqf mailto  shae sevice gmbh mage diecto gesch ftsf he phvkowml azbtkqwx uedlk mpvhakdq,GRP_0
4352,een ep sid accot vvaghjnthl henghl team kindly  assist eset passwod use hydstheud mddwwyleh opeation supeviso  distibution sevice asia pte ltd email mailto,GRP_2
4353,logon balance eo    south afica office log ep get look like diginet line effect eveyone kind,GRP_0
4354,use mabelteghj ep logon   log kindly assist kind,GRP_0
4355,ep system moning   syghsa lock shutdown compute still  south afica,GRP_0
4356,ep   assist log eceive follow eo,GRP_0
4357,ep  tust well   cant lock give code,GRP_0
4358,daw call temil iso nnen tool fction equie ode povision,GRP_42
4359,bobj eo issue efesh global spend alytics epot,GRP_9
4360,job bkwin tax inteface daily fail schedule citical device addess find backup statistic session queue ti hou complete disk agent abot total dium mbytes use eo,GRP_8
4362,delete cham  long equiedequest equie,GRP_38
4364,job bkwin host inc fail schedule majo lose connection vbda   com host ipc subsystem epot ead eo system eset pee,GRP_5
4365, load enginee tool new say connect intenet  cell,GRP_0
4366,vpn allow access ep second ti week issue wokaod monday wok eithe even pfzxecbo ptygkvzl alyst indiect industial sale mailto,GRP_0
4367,enginee tool phone app   attach sceenshot long  check availability ssage  connect seve  installing einstall fix poblem know issue like week,GRP_51
4368, emove quyhn mcgudftige usa campus calenda equest cwuospin nbhoxqpe send wednesday septembe othybin gaceuyt nwfodmhc exucwkm facility akthh elt update call   ely stanfghyley guhtykes fmp mage sep wite check  et,GRP_26
4369, last secuity update  pint anything netwok pinteseo ssage ask tust pinte tell  download dive phone numbe,GRP_0
4370,application esponse ti netwok esouce wok nomally  povide detail template multiple impact use quick ticket opeation folde site location usa use steince system  pefomance poblem list cm ep bobj sid tansaction slow ceate ode aea belong sale fince makhtyeting etc pocess issue eplicate suppot goup emote attach elevant sceenshots exact occu,GRP_4
4371,outlook cm eo neithe load estat ti lock seveal synchonize login wghjkftewj image jpg,GRP_0
4372,contact load imts exist accot cay equie field ep cm msdpospect co incoectly elm,GRP_40
4375,office qohfjp exphkims show activation equiedwe  eimage palghjmal co  image deeghyupak aju equie  leslie accot associate poduct always   check fix,GRP_26
4376,emove   ujpckto lhutkpxm themfg gp goup,GRP_0
4378, change passwod get sync system,GRP_0
4379,outlook allow open email inbox connect use system use teamviewe send uacyltoe hxgaycze mail mailbox confim  advise close eopen outllok check calle  issue esolve,GRP_0
4380,extel monito detect dell tt,GRP_0
4382,pinte poblem issue infomation complete equie question etun back gsc equeste povide infomation eview ticket  esolve  assign appopiate goup pe assignnt flowchat  make model colo lasejet pcl detail desciption  send doct say dive update  next click pint stat download epeat seveal ti display eo window due cuent setup machine type email excel wod etc inwaehouse tool delivey note poduction ode specifically micosoft  system application use ep kls outlook espond ping command netwok powe cycle sid hp plm output eouted anothe tempoaily coectly scan copy attach,GRP_3
4384,pinte dive eo  know happen get  pint nomal default say  instal box sceenshot pop close snip tool away back evey ti use show monday bzxljkoy voiqthl,GRP_0
4385,pc set new employee mghlisha baanwfhty setup laptop hie,GRP_19
4386,wifi issuewifi get connect,GRP_19
4388,spam emailfom vmqcyzda kgvfwcj send wednesday septembe on pot nwfodmhc exucwkm tjlizqgc ngvwoukp ytqhfmwi itkpmc billghj dhjuyick lipfnxsy vjlnpef ama summit et impotance high  desk email legit look like upcoming business pactice best,GRP_0
4389,set new employee kisyuhnytkutya kghpanhjuwdian,GRP_19
4390,pdf pintei want softwae pint doct,GRP_19
4391,change old pcconfigue new laptop emove pc,GRP_19
4392,fequent accot lockoutmy get lock fequently wok gso many ti still  check end,GRP_2
4393,mii uacyltoe hxgaycze lacw duation high load efesh,GRP_14
4394,appove expense epot date ange eoess potal wong show  say change ode ente,GRP_10
4395,lock skypeand,GRP_0
4396, host skype et confeence oom,GRP_0
4397,vip pinte dive update,GRP_0
4398,ep use block  lock imdiately extend accot necessay tomoow  ghjveicj dec  tszvoba wtldpncx mailto send wednesday septembe nkjtoxwv wqtlzvxu lixwgnto kutnylz egad ugently impotance  hohgajnn want log ente coect login detail fotutely conside imminent bill activation many thank advance team leade logo new fil klein pesol patne stixne gmbh commication intend solely use addes may contain infomation confidential exclude disclosue applic law distibution epoduction peson ecipient stictly fobid eceive mistake notify sende ssage  post select follow link view disclai altete language,GRP_0
4401,poblem pint   netwok pinte aea get pop install dive eo  ,GRP_0
4402,pice eo ode numbe  change   fix issue inwaehouse tool ceate tonight,GRP_13
4404,eset passwod ahydmbu fjymgtvo telephony softwae   softwae supeviso system,GRP_7
4405,accot lock ad afplnyxb eiomnuba language bowse micosoft intenet exploe email custo numbe telephone summay passwod vpn blokke  eset teh use vanghtydec change lock,GRP_0
4406, log outlook moning moning micosoft cm add coupt,GRP_0
4407, get skype calls bixsapwu lcamiopz language bowse micosoft intenet exploe email custo numbe telephone summay eason call confeence oom usa campus,GRP_0
4408,powe outage vogelfontein vpn cicuit site pimay type netwok  specify top cet  stat schedule maintence  povide maint ticket backup active contact notify phone email emote dial equipnt eset veify wok vendo global telecom veizon gsc additiol diagnostics,GRP_8
4409,update use inteaction desktopupdate desktop ypdhesq eotjzyxm qll,GRP_7
4410,infotype exist pesol phone,GRP_10
4411, install font ovxwqybe gevzklp email telephone summay  font instal,GRP_3
4412,ticket comnt add sceen pint attach highlight field list speadsheet povide live sid example eview incase weent awae pfzxecbo ptygkvzl send fiday septembe aghfhgh gowhjtya question  let know,GRP_9
4413,sid use lock,GRP_0
4414,mii update,GRP_0
4415, login vpn vpn page stop check antivius client,GRP_0
4416,eo fail eset cache passwod lock lock new update email access secue cell phone,GRP_0
4417,vmsliazh ltksxmyv edksm  change schedule job impot complete ep data nightly file m miss ecod late update milano  simplyfies suppot value field occu stat attach pictue,GRP_49
4418,speake wok issue toubleshoot  hadwae toubleshoote get ssage heh toolhone connect device check mage ealtek audio dive instal  update avail download dell com suppot system  install play use eaphone fine confim conclusion eithe,GRP_19
4419,outlook espond cm sync,GRP_0
4420,eset ptgghj passwod passwod,GRP_0
4421,pint host  mandatoy eboot monday tkwehzg pqjhsul   moning  successful attempt dialogue box pop copy dll file dive eo ssage say stat check pinte setup window contol panel update dive download seveal application outlook excel adobe eade success use still  spit ep ode one enginee,GRP_0
4422,skype audio fctiolity wok pe expect,GRP_26
4423,lock sid  eset passwodsystem hp ente use issue tansaction code  wok descibe get authoize ssage eceate condition nsu attach esult ticket tool povide access,GRP_2
4424,outlook passwod pomptmicosoft connectivity alyze softwae confim old suppot download instal sevice pack fail find epai office installation clea cedential mage delete pofile content app data local estat micosoft vesion,GRP_0
4425,ep issue invoice insufficient stock even though inventoy avail custo sevice usa sale ode acct consignnt show may batch block pevent allocate inventtgoy bill pupose sothing odd maghyuigie ghjkzalez,GRP_13
4426,open attach inwaehouse tool opentext ep  attachnt,GRP_0
4427,tansfe tool tial epot old laptop new     subject case,GRP_0
4428,mobile phoneno mail eceipt use jkuaslxe hodszpl gezpktq opkqwevj would  contact cuently eceive phone note tavel outside gemany,GRP_63
4429,mii wokingmii take min load eveyone get eo attach,GRP_0
4430,wl scanne wok pinte fine phone,GRP_33
4431,file seve fctioningthe light back one site blink pat plant access netwok esouce   check local host lsm contact,GRP_12
4432,shop floo app passwod misplace  deghjick culghjn language bowse micosoft intenet exploe email custo numbe telephone summay foget,GRP_43
4434,ep mii host jstat exe sevice show citical,GRP_14
4435,mii technical eo acoss usa location eceive system even log contact numbe,GRP_41
4436,editing cuent situation  file avail follow link  today long edit eo ssage display open yous ely,GRP_16
4437,mii uacyltoe hxgaycze lacw duation high load efesh,GRP_8
4438,ep mii fction aonoke apid employee  use softwae clock lock phone,GRP_41
4439,bnsh accot lock ep sid,GRP_0
4441,business client espond  efe sceen shoot wam,GRP_0
4443,pinte poblem issue infomation  pint hqntn dive  update  complete equie question etun back gsc equeste povide eview ticket  esolve assign appopiate goup pe assignnt flowchat  make model detail desciption load type doct email excel wod etc inwaehouse tool delivey note poduction ode system application use ti window ep kls espond ping command netwok powe cycle sid hp plm output eouted anothe tempoaily coectly scan copy attach,GRP_0
4444,vpn issue   madam  connect  addess  install new apvpn well,GRP_0
4445,ng accot lock ep sid,GRP_0
4446,eemw bacode scanne defective  eplace locate cvd aea,GRP_42
4447, pint  dive update,GRP_0
4448, pint dive update,GRP_0
4450,install vlc    playe system  play poduct demonstation wmp,GRP_0
4452,sevice kit liefen hcuixqgj mavxgqbs,GRP_24
4453,poble mit office dtlmbcx mwuateyx,GRP_24
4454,poblem batch magent tmqfjad qzhgdoua,GRP_24
4455,poblem batch magent howfanzi siavgtby,GRP_24
4456,setup new uadkqcsj xtmjlai,GRP_24
4457, assistance tansfe elengineeing toolonic amb show ticket onto  iphone,GRP_28
4459,excel issue  open file follow eo ssage oute gu,GRP_16
4460,activation folde data dive depatnst host  activate wite ead access equie wok,GRP_34
4461,efdl outlook issue  passwod change open   mit fedlichen kind,GRP_0
4463,estoe delete oppotities shikghtyuha pe email m use ukwfgxl ieqbtnp oppotity anothe qfmcjak gcxvtbz detail opotities visible anymoe say peiod septembe likely oppotstoage poduct  stat seibel   veify chance,GRP_40
4464, eactivate tempuse sid ep poductionpls eset passwod podn,GRP_2
4466,fequent wifi diconnection new bay basis aea team  check disconnection connection ep skype disconnect,GRP_4
4468,set eemw pinte pat pogam,GRP_42
4469, eset sid ep passwod ,GRP_0
4471,ep lock gso  lock sid accot tjtigtyps soon eset passwod,GRP_0
4472,zollefgh machine image estoation  genius  estoe pen dive   issue ugent basis,GRP_19
4473,pinte fau zeilmann defective pape cease pint copy pocess,GRP_42
4474,hadwae damage  facixepyfbga wtqdyoin wae issue laptop monito plastic potion co goove leave contol key wok kindly take necessay action detail wam,GRP_19
4475,ep logon passwod  send new lose mine soy janhytn ooshstyizen sale mage constuction mailto oad king bite catalog,GRP_0
4476,pdod elease   fix business tansaction cay,GRP_45
4477,entepise scan client open text ep  instal oncompute eagw connect scanne fujitsu dive  compute online nobody wok take eveyti contoll viewe aleady site suppot  let know,GRP_0
4479,vpn symantec,GRP_31
4480,monthly quality wok goup qwg global od tool input    team pls  alf email last month wite access issue possible paticipant collaboation platfom file even  change update save espective idea handle,GRP_16
4481, suppot  mateial use puchase  eplicate best,GRP_29
4482,bw seve eo ssage team one  use uxndyfs vahxnfgl sotis ssage think ep connection issue solution show happen access stop xmgptwho fmcxikqz takeshi asano,GRP_9
4483,ep access issuesystem sid hp ente use issue mathyida tansaction code  wok  logon lock descibe  lock accot eset passwod system,GRP_2
4484, update pofile detail give use shighjvnn find eo  assist,GRP_25
4485,vius laptop system effect  emove pemanently find sceen shoot,GRP_50
4486,accot get lock host,GRP_2
4488,poblem log vpn eceive eo ssage say use passwod incoect even though know coect,GRP_0
4489,guest wifi login use    ceate pemanent office  passwod guest co tain et  best,GRP_4
4490,delivey display inte bill eo ssage exist  pocess ode ship system due egiste,GRP_18
4491,log vpn cagty language bowse micosoft intenet exploe email custo numbe telephone summay vpn,GRP_0
4492,ep accot lock,GRP_0
4494,job sid hoti fail schedule,GRP_5
4496,ticad geneate automatically,GRP_36
4497,cicuit outage gemany  pimay mpls  site secondaywhat type netwok powe  specify top cet  stat schedule maintence povide maint ticket backup active contact notify phone email emote dial equipnt eset veify wok vendo global telecom veizon gsc additiol diagnostics,GRP_8
4498,netwok outage isael sale facility  type cicuit powe  specify top cet site  stat schedule maintence  povide maint ticket backup active contact notify phone email emote dial equipnt eset veify wok vendo global telecom veizon gsc additiol diagnostics,GRP_8
4499,cicuit outage pais  pimay mpls  site secondaywhat type netwok powe  specify top cet  stat schedule maintence povide maint ticket backup active contact notify phone email emote dial equipnt eset veify wok vendo global telecom veizon gsc additiol diagnostics,GRP_8
4500,netwok outage isael   type cicuit powe  specify top cet site  stat schedule maintence povide maint ticket backup active contact notify phone email emote dial equipnt eset veify wok vendo global telecom veizon gsc additiol diagnostics,GRP_8
4504,cicuit outage gemany steel plant  mpls  site secondaywhat type netwok powe  specify top cet  stat schedule maintence povide maint ticket backup active contact notify phone email emote dial equipnt eset veify wok vendo global telecom veizon gsc additiol diagnostics,GRP_8
4505,equest eset micosoft online sevice passwod kind,GRP_0
4506,inquy email wok phone without intenet connection,GRP_0
4507,wallpape beshyu  change window the,GRP_0
4508, commicate savin pinte,GRP_0
4509,host ep seach seve epstatsv exe sevice ,GRP_14
4510,m excel ight click wok connect use system use teamviewe epai office eopned fine issue esolve,GRP_0
4511,uacyltoe hxgayczeing avail get sid,GRP_0
4514,po epot pull seach esult connect use system use teamviewe    scen shoot give eo attachnt contact,GRP_21
4517, pint keep ask install dive pinte,GRP_0
4518, pint  usa,GRP_0
4519,np issuesi  access template load site ente custo,GRP_21
4520,ceate goup collaboation platfom get eo ssagei  people ssage ability tun peson mage email,GRP_16
4521,appove pimay email cm use kpobysnc tqvefyui poductioppove qlhmawgi sgwipoxn call msd poduction,GRP_16
4522,compute connect pinte keep instal dives team aftenoon stop attempt pint doct pompt install dive let open  thing tell main use  febuay sue suddenly wok   assist get mont appeciate anothe neaby anti allow netwok  contact feel fee call each via skype,GRP_0
4523,setup client laptop,GRP_3
4524, open powepoint file lpiokwa bgwneavl language bowse micosoft intenet exploe email custo numbe telephone summay difficulty powe point say epai click,GRP_0
4525,sync intel collaboation platfom notebook update passwod use magent tool ask ente cedential old say incoect newly ssage contact seve infomation pop dieppeas sign shae cowokes attach video show happen,GRP_0
4526,geneitc issue msoffice vesion,GRP_0
4527,vip geman payoll collaboation platfom site equest   ceate standad template implentation poject owne jywvem qngschtz lixwgnto kutnylz backup full update access  usaed pzcxbml vnjdghui tvcdfqgp nbcqwgj johyue ghjuadt jfcdavy sxpotjlu nichty edmhihyu equie vendo extel  cetain folde well infom soon many,GRP_16
4528,ep passwod esetic welco next avail agent shotly inteaction alet website visito join convesation hakim belhadjhamida lock ente wong one way change moning akthh amdntythanjesh hakityum,GRP_0
4529,ep sid accot lock laffek,GRP_0
4533,backgod epot ep ning nightly long  day eset still,GRP_13
4534,lock cm  get shipnt today vfjsubao yihelxgp language bowse netscape email custo numbe telephone summay today,GRP_0
4535, activate new iphone  own device nwfodmhc exucwkm send tuesday septembe fmzdkyqv dbslnhe sab die synchonisieg mit exchange activesync ist auf ihem ge vo begehend blockiet zugiff vom administato gew ht wid michghytuael successfully,GRP_0
4537,lhqsm dive space consu avail gbvolu label dat eea seve,GRP_1
4538,audio doesnt wok anymoe laptopneithe eabuds plantonics,GRP_0
4539,pinte installation fbhyeksq caexmols language bowse micosoft intenet exploe email custo numbe telephone summay  pint update dive howeve still say ,GRP_0
4541,ep sid accot lockedlocked confim use,GRP_0
4542,lock passwod magent tool  eset vfjsubao yihelxgp custo sevice epesentative,GRP_0
4545,ticket udpate inplant inc jashyht use call ntion   get wieless tavel,GRP_0
4546,add qiw qigfgage qlhmawgi sgwipoxn seghyughei language bowse micosoft intenet exploe email custo numbe telephone summay sgwipoxn,GRP_34
4547,ti cad miss sevice change supeviso fom sagfhosh kahtyiio send tuesday septembe abhtui edula ufpzegq zchjbfdehivashankaaiah kupnshb gsmzfojw inc ticket tool  look like ticad last two week august  check team mbe venkat issue equest eihyuk bauhty xabkyoug wdkyiqfx assign  take evet claification,GRP_36
4548,pdf file get save feeze seve,GRP_0
4549,call disconnect due vpn disconnection,GRP_0
4551, pint,GRP_0
4552,geman call calle disconnect,GRP_0
4553,micosoft wod stop wok  open file,GRP_0
4554,use want contact h,GRP_0
4557,fequently get eo outlook application ssage attach,GRP_19
4558,call get disconnect vpn go,GRP_0
4559,auto output inwaehouse toolsauto tool siens set howeve email tigge line invoice custo website,GRP_13
4560,pinte poblem issue infomation ecu poblem complete equie question etun back gsc equeste povide eview ticket  esolve  assign appopiate goup pe assignnt flowchat  make model detail desciption say install dive pint type doct email excel wod etc system application use ti espond ping command netwok powe cycle  ep output eouted anothe tempoaily coectly scan copy attach tool,GRP_12
4561,zco vaiant plant odstock wok ep,GRP_44
4562, ceate new expense expense show infotype eo,GRP_0
4563,sandi usa inteface ,GRP_8
4564,inwaehouse tool include paynt poposal,GRP_10
4568,call pivate numbe get disconnect,GRP_0
4569, connect egula pinte host,GRP_0
4570, usa switch access com inteface fastethenet fuce ay jankowski,GRP_8
4571,machine kentip division long stat,GRP_33
4572,ep poblemsif want open daw compute evh log two ticket aleady wite poblem yet esolve,GRP_0
4573,impossible emove co oigin data inwaehouse tool expot custo make uacyltoe hxgaycze xawlkiey demjqfl sid numbe  pofoma example  note english sentence automatic one fench manual maste level classification check pint info wok,GRP_13
4574,ugent pesonnel numbe accept tavel expense mage ep,GRP_52
4575,host aveage sample disk fee,GRP_12
4576,back   eset database mak plan stock epot daily xlsx thank cflqoew qbgjwaye pocess mailto  poduktions gmbh mage diecto jofghyuach faby phvkowml azbtkqwx uedlk mpvhakdq sole use ssage the addes detemine may contain infomation confidential exempt disclosue applic law distibution epoduction commication people intend ecipient stictly pohibit occu due eo  notify sende send post select follow link view disclai altete language,GRP_24
4577,poble mit potal ujtmipzv cwdzxs,GRP_24
4578,ti ecod wok quality magent xwizvda okhyipg,GRP_24
4579,scanne toligic compute defective zedlet,GRP_24
4580,install  bacode ewew vzqomdgt jwoqbuml,GRP_24
4582,epeat pint tip pinte,GRP_31
4583,host label dat bcd space consu avail g,GRP_12
4584,qlhmawgi sgwipoxn lock,GRP_0
4585,puchase feetext equisition ceatedwe seious issue ceate shop ca buye goup apac default change  belong diffeent puch og cause eo ovewite m happen cat  imdiate action one,GRP_29
4586,vip outlook wok ask passwod pompt co,GRP_0
4587, mateial plant thankswe,GRP_6
4588,access sid,GRP_0
4589,eo ode puchase catalog  discuss hotline send ssage appea contact,GRP_29
4590, cute pdf instal,GRP_19
4591,vpn wok action equie  connect new ul januay  kindly ,GRP_0
4592,use tfazwdv upwonzvd  change atcl old atclx want update telephony softwae system date septembe gmt  ajyutyi   put station  net new mac addess best,GRP_7
4593,ethic guten mogen leide kann ich den kus nicht absolvieen keinen zugang bekom hiehe geht mit besten nschen d gasbfqvp fmvqgjih designe poduct enginee wea solution  shae sevice gmbh tel fax mobil mail adesse www com eckesdofe sta gemany bayen gesch ftsf he mage diecto phvkowml azbtkqwx uedlk mpvhakdq sitz egiste office th bay egistegeitcht list cout ha pes nlich haftende gesellschaftein geneal patne deutschland bad hombug hb,GRP_23
4594,puchase equisition  attachnti attachnt accot equie assignnt object select bye,GRP_29
4596,compute stat,GRP_31
4597, install nvyjtmca xjhpznds applications application job schedule backup tool vmwae vnc viewe  ask administation access,GRP_19
4598,new fax icoh folde  malaysia public amssm   end august   check fix poblem,GRP_12
4599,outloot,GRP_30
4600,job bkwin seach seve daily fail schedule,GRP_8
4601,extact file equest use scm bapi,GRP_9
4602,  qskwgjym bsqdaxhf delete paamdntyetes paynt  code,GRP_10
4603,job sid stat fail schedule,GRP_8
4604,g eo  would   complete qty cid,GRP_29
4605,switch  ind kity coat access locate india ,GRP_8
4606,job bkwin tax inteface dev daily fail schedule session queue ti hou complete disk agent abot total dium mbytes use eo,GRP_8
4607, esolve item categoy eo zfd ode  team face issue fee chage select zkln  check detail sale og type qty delivey plant usage poduct lose intans without hence ep identify open  sceen,GRP_13
4608,job ha sid ep dly fail schedule majo dev mt wite device eo citical abot equest session queue ti hou complete disk agent total dium mbytes use,GRP_5
4609,job sid filesys fail schedule majo dev mt wite device eo citical abot equest session queue ti hou complete disk agent total dium mbytes use,GRP_5
