,TranslatedDescription,Assignment group
6637, mouse defective,GRP_33
6638,pc eincke wzs pobably defective machine,GRP_33
6641,pinte wok tone change,GRP_33
6643,l fte defective compute video suveillance,GRP_24
6644,usb keybank monitoequested keybankd extel monito new desk space,GRP_19
6645,use cwfzldts dlmukhyn ceate puchase equistions pch catalogueshe get eo docttype avail backend system  attach ssage wok m sothing usesettings,GRP_29
6646,setup compute ewew wcktgbd wzgyp,GRP_24
6647, netwok c telesevice obowoke  bghakch emain pemanently connect,GRP_24
6648,poblem lan et oom puxsvfw cwkji,GRP_24
6649,accot  m cmi issue  ceate opputities cm  nomally wok connect enginee tool   solve,GRP_40
6650,convesion issue daw nxd pdf get convet accessible model dxf accesible,GRP_0
6651,attendance tool issue   mam face follow ssage show single sign potal  kindly  esolve,GRP_0
6653,change login passwod magent tool mange successful estat system outlook sky wnozsyv mdflqwxg language bowse micosoft intenet exploe email custo numbe telephone summay skype pop equest log,GRP_0
6654, send eceive email,GRP_0
6656, login attendance tooli tool use single logon potal link,GRP_0
6660,job tooldplcmmaninp fail schedule,GRP_8
6665,awyw  attend ntion poblem ealy system  use talagtym display co monito get continiously best,GRP_19
6666,micosoft office softwae poblem access link pop wan compute limitation contact phone system window eo ssage  efe attachnt,GRP_0
6667,ship notification  would  set email custo,GRP_18
6668,netwok outage  che switzeland dmvpn t backup  estwhat type cicuit powe  specify top cet site  stat est schedule maintence povide maint ticket active contact notify phone email emote dial equipnt eset veify wok vendo global telecom veizon swisscom gsc a additiol diagnostics,GRP_8
6670,ksem wzs defective shut independently long stat  take cae himghtleich,GRP_33
6671,advance seach use mateial field fomthe set esult etun egadless leave blank select,GRP_25
6672, open jpg image file  ,GRP_0
6673,low usa obot outlook complete ti kityled alet epot tool  et,GRP_8
6675,job  long minute fail schedule,GRP_6
6676,usa esolved mii passwod lockout employee get use authentication fail eo confim poductionhi occuences people totm hotl howthelte yqxlbswt eimhxowu tnhymatj ligsnzu smcxewk gagtfl   check oot cause lock opeato log epot poduction lee  magent tool  min  wok othes veify active diectoy  tony minute esolve issue end shift,GRP_0
6677,job tooldplcmmaninp fail schedule,GRP_6
6678,dell blue sceen eo ugent use  ecove safe mode estat opetions  sevice tag sjv asset win,GRP_3
6680,distibuto tool page eo,GRP_0
6681,send automatic ep gui upgade stefdgthyo language bowse micosoft intenet exploe email custo numbe telephone summay upgade,GRP_0
6682,netwok outage india  had  etwhat type cicuit powe  specify top cet site  stat schedule maintence povide maint ticket backup active contact notify phone email emote dial equipnt eset veify wok vendo global telecom veizon gsc additiol diagnostics,GRP_8
6683,vpn connection issue connect use system use teamviewe change default bowse advise calle logon  confim  login esolve,GRP_0
6685,mobile device activation new iphone,GRP_0
6686,decimal value daily qty confim usa plant wok cente peeco show ntion field efeence collaboation platfom section page cce end,GRP_41
6687,otd feeze date alet issuein supeviso dashbankd populate coectly efeence collaboation platfom section page plant dac end,GRP_41
6688,setup ti calculate popelyemail kanchi usa confimation mii one example kahthyeui find use wok cente factoy calenda exclude weekend calculation case detail page collaboation platfom ep section end,GRP_41
6689,global ep cm  investigate agbighyail espinosa employee accot ecognize employeeglobal efe sceenshots attach email wdkaoneh qlapk display seach use ole find specify,GRP_15
6690,seach wok cente machine field collective confimation heade level ep mii numbe type pop box ti event nomal,GRP_41
6692,change condition tab  appea access value  eview issue  complete quote convet usd instead ub,GRP_13
6693,eset passwod pzjelyxg vstyaouc use magent tool,GRP_17
6695,quada chek eaymvzj bumzwtco stat powe connect nthing button pess,GRP_3
6696,collaboation platfom site owneship    owne leave   eallocate subsite ,GRP_16
6697,vip  open file collaboation platfomstdezpqw bkuhfz neve  kind platfom keep ask email addess passwod even ente co back,GRP_16
6698,access  collaboation platfom  eithe page stick blank outlook office com show,GRP_0
6699,ep ode acknowledgent weight diffeence   eview quantity attach column coect desciption field qty incoect value aea,GRP_13
6700, load collaboation platfom,GRP_0
6701,india  tcl cicuit intemittently flap  est site active pimay intemittent link,GRP_4
6702,appove cedit mo seveal ti  eview appove level stefyty oss diecto sale wokflow happen,GRP_13
6703, login eplacent laptop show connection seve,GRP_0
6706,skype connectivity flicke automatically signout sign back sfb online outage seve end netwok team kindly look issue office multiple use keep ticket pioity sev till esolve,GRP_4
6707, access net weave  kindly ful,GRP_0
6708,team spoc assign indiect evenuethe tam incoectly inne join pevious ytd evenue leave wont esult empty set aka fist peiod fincial toolcal yea,GRP_25
6709,pikosa log wok station xepcsvh tbsokfyl seveal day wokstation telephony softwae say use specify sceenshot attachnt station want always  advise,GRP_7
6710,download daw esponse eo even though succesful email send input always get eply still example mail sale doc delivey bill puchase pu sch ag mat num language flag doct numbe special mateial pdf expect definitely fine howeve ep make sense impotant file ftp site wok etun valid ssage successfully,GRP_20
6712,netwok outage kingston site had  backupwhat type cicuit powe  specify top cet  stat schedule maintence  povide maint ticket backup active contact notify phone email emote dial equipnt eset veify wok vendo global telecom veizon gsc additiol diagnostics,GRP_4
6713,cicuit outage usa divestitue site seconday  pimay type netwok powe  specify top cet  stat schedule maintence  povide maint ticket backup active contact notify phone email emote dial equipnt eset veify wok vendo global telecom veizon gsc additiol diagnostics,GRP_8
6714,email   accot tab emove main new one add hntl usa gind westcoast c mailto,GRP_0
6715,cicuit outage vogelfontein south afica seconday  pimay type netwok powe  specify top cet site  stat schedule maintence  povide maint ticket backup active contact notify phone email emote dial equipnt eset veify wok vendo global telecom veizon gsc additiol diagnostics,GRP_8
6716,oadking featuesthe featue oad king page expand click div containe suppose open show additiol content long wok  sceenshot attach,GRP_51
6718,poblem vpn client  gentleman use follow eo ssage get co thid  use passwod  check send thank note best wish,GRP_0
6720,equie access cadian legal epot website thank advance wznkpjis antlypb tsp ehs alyst mailto,GRP_0
6721,use  connect dive,GRP_0
6722,equest eset micosoft online sevice passwod sabthy suhhtyju ,GRP_34
6725,equest eset micosoft online sevice passwod sabthy suhhtyju ,GRP_0
6726,skype call wok make hea,GRP_0
6727,logon miss ep mitctdh whaley language bowse micosoft intenet exploe email custo numbe telephone summay ep issue cant login avail,GRP_0
6728,symantec softwae ssage   attach keep get evey ti switch lap top,GRP_0
6730, boot system window,GRP_0
6731,netweave passwod wok,GRP_0
6732,bluetooth mouse wok,GRP_0
6733, login past ,GRP_0
6734,secuity incident dsw suspicious pc netbios activity host oveview detect least occuence fiewall  intel asa com dop taffic souce destine pot one destition device may indicate follow host misconfigued scan authoize uuthoized escalate via high pioity ticket phone call pe default event handle pocedue would like diffeently futue  option question concen  let know eithe coespond delegate back soc escalation alet block explicit notification dium automatically esolve potal avail epot pupose ely secuewoks technical detail histoically vaious wom malwae use popagate example include blaste msblast lovsan welchia chi eatle micosoft epmap end point mappe  dce locato sevice  datagamdnty session smb file shae additiol infomation best pactice find site efeence data elate summay outbeak tcp cot connection apusm diectiolity potocol log ti utc action scoe scwx pocess shelock ule sle inspecto ontology type agent aug inbod deny flag syn inteface inside,GRP_12
6735,downgade,GRP_0
6737,waehouse tool quality issue high link utlization usawaehouse utilization usa,GRP_4
6741,monito oientation eo,GRP_0
6742, own iphone steal,GRP_0
6743,micosoft passwod eset,GRP_0
6744,qlhmawgi sgwipoxn passwod woking inhekdol anvqzdif language bowse micosoft intenet exploe email custo numbe telephone summay  call aep spengineeing toolote compute fody post floo sample alyze shut posting citical,GRP_0
6745, get amdnty,GRP_3
6746,eti wok,GRP_3
6747, check josh phone,GRP_3
6748,setup access ethic,GRP_0
6749,seve migation gemany  access file folde new,GRP_0
6750,secuity incident possible to activity souce andoid edc host cente com destition system  use pethyw sahl sghtyhlp location koenig sep status update field sale  dsw event log  data elate summay deny icmp tafficdenied type code occuence cot host connection infomation intenetsuvey eatasec geolocation atlanta usa diectiolity incoming potocol device  intel asa ti utc action block scoe scwx pocess shelock ule sle inspecto ontology agent detail aug inteface outside,GRP_2
6751,seve migation gemany contactpeson cioehnq wfyhgelz access data poceed custo ode,GRP_12
6752,ep allow ceate attachnt custo accotwhen  attach tax exemption fom accot  access netwok dive stoe eceive eo ssage incident,GRP_0
6753,use question use passwod magent tool mage,GRP_0
6754,eveyti click sothing ep hea annoy clcking sod   access doct heade get pop gui secuity say system ceate file confimationofhpcpo msg diectoy want usa pemission modify paent subdiectoy give choice allow deny  open attachnt,GRP_0
6755,eplace cuent laptopthomklmas laptop,GRP_3
6756,co upnot showixepyfbga wtqdyoin dive,GRP_3
6757,email update moning kind,GRP_0
6759,passwod poblem lock log  netwok sign,GRP_0
6761,ep blank sceen,GRP_0
6762, stat compute show statup epai,GRP_0
6764,eset passwod hoeduca oghivnm use magent tool,GRP_17
6765,ep sid passwod eset equest ughzilfm cfibdamq,GRP_0
6766, open file attach cm extension a filethe wok know,GRP_3
6767,ead wite access dive folde  povide follow coat data base database poduction day wise month compute  use detail pe list slno system numbe awyw awysinic sbfhydeep kutya gind opeation mailto,GRP_12
6768, outlook,GRP_0
6769,eset passwod mfvkxghn mzjasxqd sid epi  set quality assuance aea,GRP_0
6770, ceate wok schedule employee nibmcve xukajlvg pes taget ti week hou day tuesday thusday satuday stat,GRP_52
6774,skype disconnect call ti minute koenig gemany confeence,GRP_0
6775,accot get lock monday,GRP_0
6776,atualiza pogamdntya tedpeciso entega declaa ted est fciondo,GRP_62
6777,vip symantec login synch passwod hitacni system update,GRP_0
6780,access ight folde team leade appoval gegtge,GRP_0
6781,set back doct  status dispo avpoduction ti wok planne contolle coat cut plate pvd taplas system xl,GRP_12
6782, login epsid ep poduction accot lock,GRP_0
6784,eset passwod ep vvkthyiska accot block  team   use mistake ente ti wong,GRP_0
6785, excel update cm   advise step take allow attach speadsheet efesh data eo ssage get open en content mictbdhyhle bunhntyham egiol key accot mage msc east coast mailto,GRP_0
6786,miss achive email  lauacyltoe hxgaycze find   local suppot ojplsmx wslifbzc aleady check well ugently   advise best,GRP_0
6788,misplace passwodpasswod,GRP_0
6789,edi ode ksb  lady gentleman  give shot call fiendly child,GRP_32
6790,deploynt notification telephony softwae  geman language fo gemany location follow taget efdl efdw edfl edfw  let know plan move weekend manually ight,GRP_0
6791,eset passwod kanos  team   use,GRP_0
6792, find folde outlook welco next avail agent shotly busy assist custo inteaction alet website visito join convesation gxuvbcp libcktnm  dwfiykeo agtxmvcuma soy distub issue think delete  anymoe access system  sue way teamviewe skype team viewe  tanspotation makhtyet one leave,GRP_0
6793,delete cham configuation aleady issue bex epot,GRP_38
6795, login citix,GRP_0
6796,poble mit login ypladjeu wzfyxav,GRP_24
6797,poble mit outlook dtlmbcx mwuateyx,GRP_24
6798,pinte wok puxsvfw cwkji,GRP_24
6799,confimation bls beschichtgsleitstand tansfe toollocation gemany coat depatnt cvd example batch happen egulaly evey ode miss pack fhuakgsl mldufqov tool geman packen zum beschichten howeve confim usually automatically poduction planne  close gap manually pocess step incident  impact pefomance indicato ti cedit system cuent issue aise aleady past,GRP_25
6800, open ode confimation ep  find sp shoot sceen ul,GRP_13
6802,system disk seve host full   check vitual cente,GRP_12
6803,pesol dive adelhmk long avail seve migation  estoe soon possible uvail,GRP_12
6805,cm poblem  system open pompt passwod mo cuent month outlook appea sceen kind,GRP_0
6806,double click poduction ode ep epot distibution icon co inset amot allow ship each,GRP_45
6807,pinte find scan addess  peset best fiend,GRP_12
6808,po pose mio ssagethe attachents eo ssage show ep poblem   settle,GRP_10
6809,sod issuesod wok,GRP_19
6810,enginee tool advance seach issue   epot sale peson  atuldhy gupthy howeve get match use kindly check best,GRP_25
6811,telephony softwae input issue ente one numbe lette output double eply email new softwae upgade get show two duplicate example pls find attachnt pintesceen   solve soon possible,GRP_7
6812,open excel attachnt  even stoage best,GRP_0
6813,ep netwok access limitation  vaious use link log get onto local dive file howeve use intenet exploe like andthyeh cvdebc vvmathkag use vanthydys evey system without issue best,GRP_0
6815,kpm wokinghous pch task visible,GRP_25
6816,ebhsm utilize label dat seve space consu avail g,GRP_8
6817,qxsm utilize label dat seve space consu avail g,GRP_1
6818,host label wsp utilize seve space consu avail g,GRP_8
6821,setup new laptop obowoke qidgvtwa qvbutayx,GRP_24
6822,bad pint quality  use pinte gemany poduction pape daw one step mont change tone oigil tewgesy tgyudf check  egad wok coect uacyltoe hxgaycze wod good fom ep suggestion paamdntyetes  echeck ,GRP_33
6823,setup new sqlmtix uhbvfgd,GRP_24
6824,awysv esxi host use viakv ping  com byte data equest ti statistic packet send lose loss,GRP_12
6825,mb download  constuct ep layout display option  ichtham  today choose anymoe one  collect ceate look like mont   get back,GRP_29
6827,data backup pofile update update old new pc,GRP_19
6828,ck epot temil sceen small clean system defective,GRP_33
6829,custo maste   india mail,GRP_0
6831,cacau michthey passwod expie day  use login would kind  best,GRP_0
6832,tt dell window  povide detail issue,GRP_31
6833, add office pinte new laptop   connect  vpn,GRP_19
6834,vvthuenka ofuhdesi hbsawmf  login potal  eset passwod shae mage emp  useid ebkfwhgt flapokym,GRP_0
6835,h tool java wok,GRP_31
6836,due file seve exchange access database simila like eemw  contact sudghnthda huy,GRP_12
6837,no access abstech eemw depatnt database betap pofile oof shape betapfasno betapfasen contact sudghnthda,GRP_12
6838,passwod change     lock ep block ente wong best,GRP_0
6839,job fail schedule,GRP_57
6840, open dash bankd tool site link web linkam kindly check,GRP_0
6842, open pemission potect mail,GRP_19
6843,kpm ti sheet submit  esolve issue soon possible employee,GRP_0
6844,ep mio pose two eo ssage like attachntas attachnt show item give say pofit cente diffeent   settle,GRP_10
6845,chk  use want confim ep show eo pls  check fix,GRP_18
6846,passwod  change today except  sid,GRP_2
6847,  ceate xzn xzs use cost cente wol  pls  find show puchaising accoss comapny allow,GRP_29
6848,enginee tool wok show eo ssage datasevices taskmg getassignnts tansaction pocess deadlocked lock commication buff esouce anothe choose deadlock victim e  ,GRP_0
6849,window passwod expie,GRP_0
6852,apps  use phone iphone skype business collaboation platfom back icloud compute best,GRP_0
6859,usa dnb vpn t  etusa oute sup engine eplacent activity pe chg,GRP_4
6860,gigabitethenet  deu gemany edksw stack com connect asid flap attach monito enginee tool,GRP_4
6861,host plm wwi uacyltoe hxgaycze wwisvc exe wong numbe instance pocess expect gte find,GRP_14
6869,india kity inteface gigabitethenet  ind stack uplink coe admin switch,GRP_4
6871,connection dive  issue get  well nte webfnhtye mage souce mailto  shae sevice gmbh gesch ftsf he phvkowml azbtkqwx uedlk mpvhakdq,GRP_0
6872,weekly eboot csqe pod seve host,GRP_8
6873,host chkdsk still  monthy ebootafte monthly eboot aod cuently veify file stage pecent complete,GRP_12
6874, chn apac psf access com  et,GRP_8
6876,use  login ep,GRP_0
6877,host sep seve  india volu label wsp space coobseving alet monito tool  enginee attach consu avail,GRP_65
6878,gemany vtx host ugent  colleague vitual seve move system ugently miss fileseve efdsm pintseve team would  kind stat many,GRP_12
6879,mtd evenue detail epot  anothe view often change make eflect teitoy miss seveal distibuto   sceen shoot qwijaspo ukynmfig sale mage west coast mailto,GRP_9
6880,vmax alet symtix powe subsystem line inteuption detect emc obseve  seveity wan categoy envionnt diecto nuitc code event inteupt desciption,GRP_8
6881,use ntion intenet get disconnect  open ppt ho location powe cycle modem  conenct inte connect system use teamviewe check netwok set fine lose connection conection stay min intemittent confeenced call comcas isp povide suppot local hotspot late,GRP_0
6883,space utilization label dat ebhsm consu avail  est volu seve,GRP_65
6885,outlook poblem stat  upmwlgb kivecja language bowse micosoft intenet exploe email custo numbe telephone summay,GRP_0
6886,outlook open laptop look ugently abd ,GRP_0
6888,secuity incident eatum scan activity oveview  att singapoe asa  com device geneate deny icmp tafficdenied type code alet taffic pot en indicative possible vulneability souce addess page equest exclude escalate via dium pioity ticket phone call pe default handle pocedue would like diffeently futue option question concen  let know eithe coespond delegate back soc full escalation explicit notification high automatically esolve potal event avail epot pupose ely secuewoks technical detail may exist acoss system application ceate path cybe attacke gain access exploit envionnt use identify quantify specific base database flaw uuthoized host knowledge  late potentially intefee sevice availability execute usa efeence data elate summay occuence cot connection infomation host intenetsuvey eatasec geolocation atlanta diectiolity incoming potocol  log ti utc action block scoe scwx pocess shelock ule sle inspecto ontology agent aug inteface outside,GRP_2
6892,lean tacke eo epeat  efe sceen shoot wam,GRP_0
6893,owa installation mobile devicehi use pesol andoid phone would like outlook access deny eject one ,GRP_0
6894,abend batch job,GRP_9
6897,extend monito cube nvyjtmca xjhpznds wok,GRP_19
6898,job fail schedule edt,GRP_10
6899,ebhsm volu label dat seve space consudebhsm consu avail g,GRP_12
6900,monito tool alet activity page wok etmonitoing log issue still show load nothing display click dashbankd ho button fine obseve,GRP_60
6902, login  enginee tool,GRP_0
6903,m cm app desktop,GRP_0
6904,ep limit attempt view sale data ow beyond numbe filte still emove show infomation fix,GRP_9
6905,poblem configuato  open  cente enginee tool get eo  advise vkzwafuh tcjnuswg cmp application eng,GRP_12
6906,chi apac inteface gigabitethenet  chn access com,GRP_4
6907,collaboation platfom quey,GRP_0
6908,access enginee tool,GRP_0
6910, login login switch  deu gemany vhsw access expeience moy issue,GRP_4
6911,call extel use,GRP_0
6912,spam bokgadu euoblcn think fyi hghtythe dop box mailto send fiday august qfcxbpht oiykfzl new pdf doct shae via image emove sende  dopbox use view,GRP_27
6913,issue compute shop floo boot powe button oange flash light thing tell use  cobgtool,GRP_3
6914,want check email spam,GRP_0
6915,inten move makhtyeting goup   callie pollauid language bowse micosoft intenet exploe email custo numbe telephone summay quick question own compute take new position,GRP_0
6916,ticket comnt add apologize update paamdntyetes ealy fail look ight ole use mktgen alluse cm basis view tcode ep uiu altyicspo famdntyewok mkt gen sv afkstcev utbnkyop senio alyst bokgadu euoblcn mailto kathght shfhyw send fiday august aoyspjv hctgfeal eqxyvfpi gbaljypo iqmdnzs mtlghwex gegyth mgndhtillen kxvwsat nmywsqg sceenshot  log office sue vpn  access khtyujuine would  poblem,GRP_0
6917,ticket comnt add send update sceenshot  log office sue vpn  access afkstcev utbnkyop senio alyst bokgadu euoblcn mailto aoyspjv hctgfeal fiday august kathght shfhyw eqxyvfpi gbaljypo iqmdnzs mtlghwex gegyth mgndhtillen kxvwsat nmywsqg khtyujuine would  poblem,GRP_0
6919,equest access cm system team   en,GRP_22
6920,distibuto tool en    ente  ep accot get outlook io,GRP_0
6922,issue update  expeience follow field patne lang multiple ti wok ep cause poblem custo eceive inwaehouse tool  makhty high pioity ecod least save,GRP_13
6923,vip pls usa access us hall site efeence belowvip aeo collaboation platfom find,GRP_16
6924,accot lock passwod eset instuction,GRP_0
6925, email accot tzekwqf homwadbs  suppot team give status issue must stat wok monday site th web access office best,GRP_0
6926,open outlookcan outlook poblem twice week aleady,GRP_0
6927,collaboation platfom phone sync,GRP_0
6928,update office,GRP_0
6929,spam email quey,GRP_0
6931,vid micosoft window httpsys ce vulneability exploit attempt cve dsw incident oveview  mapp alet geneate isensplant  com device indicate one host include http sys emote code execution intenet face successful exploitation may esult denial sevice condition vulne system escalate via high seveity full escalation maste ticket block event elate ceate singula inbod theat effectively seve eceive feedback handle fowad note block souce addess necessaily poductive due attacke ability switch use poxy anonymizing softwae to vpns  investigate envionnt detemine whethe  vesion application taget ensue ecent non patch popely haden attack would like diffeently let know eithe coespond delegate back soc call numbe option avail futue autoesolve kenel dive diectly potal explicit notification epot pupose likely best choice dium pioity phone ique elatively lage volu,GRP_12
6932,att singapoe asa  com device geneate least intel outbeak udp alet within mdsw incident oveview  minute taffic block ewll pot seveal host may indicate uuthoized econissance scan misconfiguation authoize discovey fiewall escalate via high pioity ticket phone call pe default event handle pocedue would like diffeently futue option question concen  let know eithe coespond delegate back soc escalation explicit notification dium automatically esolve potal avail epot pupose,GRP_33
6933, intel asa com device geneate high volu epeat outbod connection tcp aledsw  alet taffic block apul pot emote pocedue call pc extel host may indicate misconfiguation fiewall legitimate seve application  compomise each malicious popagate wom code escalate incident via dium pioity ticket email pe default event handle would like diffeently futue option question concen  let know eithe coespond delegate back soc full escalation window login failue explicit notification phone automatically esolve diectly potal avail epot pupose ely secuewoks,GRP_31
6934, intel asa com device geneate high volu epeat outbod connection tcp aledsw incident oveview  alet taffic block qvl pot emote pocedue call pc extel host may indicate misconfiguation fiewall legitimate seve application  compomise each malicious popagate wom code escalate via dium pioity ticket email pe default event handle would like diffeently futue option question concen  let know eithe coespond delegate back soc full escalation window login failue explicit notification phone automatically esolve diectly potal avail epot pupose,GRP_3
6936, load tool eti application ecently get new compute eve  ,GRP_0
6937,filesystem nea capacity host dsw elate event summay occuence cot host connection infomation souce diectiolity intel device   com log ti utc vendo classification none pioity window type wan use scwx pocess shelock ule sle inspecto agent detail note default alet geneate each aug mswineventlog system thu sv disk may  delete file,GRP_39
6938,login failue   open dive sceen shoot eo uwae passwod  assu sothing email late teday  thid  advise coect,GRP_0
6939,connect default pinte,GRP_0
6941,new pospect accot within cm system issue ceate day still allocate ep contact,GRP_40
6943,blue sceen eo,GRP_0
6944,outlook espond due cm eo,GRP_0
6945,accot infomation updatedfom nwfodmhc exucwkm send fiday august johthyu sab update  mail  click link access aothy nsuipbk global sevice oganization gso know ticket tool extensive self  knowledgebase easy use toubleshoot aticle contibute team well custo evey ti open equest incident ahead follow abbit image exploe issue appeciate feedback  leave comnt visit wite oigil ssage expet pla  sue theefoe best,GRP_0
6946,use lock ep sid,GRP_0
6947,spam use accot update ancile upefom log,GRP_0
6948,ep sid accot lockout,GRP_0
6949,new use id,GRP_0
6951,mobile device activation ama tempoaily block synchonize use exchange activesync administato usa access impotance high  equest configue outlook new iphone today,GRP_0
6952,e license activate office upgade,GRP_0
6953,audio wok contact numbe sevice tag summay hea sod laptop plan video use bluetooth eabud,GRP_0
6954,quey egad leaf,GRP_0
6955, scoll page,GRP_0
6957,enginee tool open eo log attach,GRP_46
6960,open business client get micosoft net famdntyewok instal eo  attachnt,GRP_0
